{
  "schemaVersion": "1.0.0",
  "paper": {
    "title": "基于图神经网络的中文文献引用预测",
    "subtitle": "一种融合语义与结构的端到端框架",
    "abstract": "学术文献之间的引用关系构成了一张庞大的知识网络。准确预测一篇新论文可能引用的文献，对于文献推荐、科研趋势分析与学术检索具有重要意义。本文提出一种面向中文文献的图神经网络引用预测框架 Papex-GNN：首先利用预训练语言模型对中文标题与摘要进行语义编码，随后将其作为节点特征接入引文图，通过异构图注意力网络同时建模“主题相似”与“作者协作”两类边。在自建的中文论文数据集上，本文方法相较基于 TF-IDF 与协同过滤的基线，在 Recall@10 指标上提升了 12.4 个百分点。消融实验进一步表明，语义编码与结构建模两个模块均对最终效果有显著贡献。",
    "keywords": ["图神经网络", "学术引用预测", "中文文献", "预训练语言模型", "异构图注意力"],
    "primaryCategoryId": "cs.LG",
    "secondaryCategoryIds": ["cs.CL", "cs.IR"],
    "doi": "10.1234/papex.2026.00012",
    "license": "CC-BY-4.0",
    "version": 1,
    "versionNote": "v1：初稿",
    "language": "zh",
    "date": "2026-08-08",
    "venue": "第十二届中文计算与语言处理会议（CCLP 2026）",
    "subject": "GNN 中文引用预测"
  },
  "authors": [
    {
      "name": "张明",
      "orcid": "0000-0002-1825-0097",
      "affiliation": "山东大学 计算机科学与技术学院，济南",
      "email": "zhangming@example.edu.cn",
      "order": 0,
      "corresponding": true
    },
    {
      "name": "李华",
      "affiliation": "山东大学 计算机科学与技术学院，济南",
      "order": 1,
      "equalContribution": true
    },
    {
      "name": "Wang Lei",
      "affiliation": "Institute of Computing Technology, CAS, Beijing",
      "order": 2,
      "equalContribution": true
    }
  ],
  "sections": [
    { "id": "intro", "title": "引言", "file": "sections/00-intro.tex", "level": "section" },
    { "id": "related", "title": "相关工作", "file": "sections/01-related.tex", "level": "section" },
    { "id": "method", "title": "方法", "file": "sections/02-method.tex", "level": "section" },
    { "id": "experiments", "title": "实验", "file": "sections/03-experiments.tex", "level": "section" },
    { "id": "conclusion", "title": "结论", "file": "sections/04-conclusion.tex", "level": "section" }
  ],
  "references": [
    {
      "key": "vaswani2017",
      "type": "article",
      "title": "Attention Is All You Need",
      "author": "Vaswani, A. and Shazeer, N. and Parmar, N. and Uszkoreit, J. and Jones, L. and Gomez, A. N. and Kaiser, L. and Polosukhin, I.",
      "journal": "Advances in Neural Information Processing Systems",
      "volume": "30",
      "year": 2017,
      "doi": "10.5555/3295222.3295349"
    },
    {
      "key": "kipf2017",
      "type": "article",
      "title": "Semi-Supervised Classification with Graph Convolutional Networks",
      "author": "Kipf, T. N. and Welling, M.",
      "journal": "International Conference on Learning Representations",
      "year": 2017,
      "url": "https://arxiv.org/abs/1609.02907"
    },
    {
      "key": "devlin2019",
      "type": "article",
      "title": "BERT: Pre-training of Deep Bidirectional Transformers for Language Understanding",
      "author": "Devlin, J. and Chang, M. W. and Lee, K. and Toutanova, K.",
      "journal": "NAACL-HLT",
      "year": 2019,
      "doi": "10.18653/v1/N19-1423"
    },
    {
      "key": "wang2019",
      "type": "article",
      "title": "Heterogeneous Graph Attention Network",
      "author": "Wang, X. and Ji, H. and Shi, C. and Wang, B. and Ye, Y. and Cui, P. and Yu, P. S.",
      "booktitle": "The World Wide Web Conference",
      "year": 2019,
      "pages": "2022--2032",
      "doi": "10.1145/3308558.3313562"
    },
    {
      "key": "sun2020",
      "type": "article",
      "title": "ERNIE 2.0: A Continual Pre-Training Framework for Language Understanding",
      "author": "Sun, Y. and Wang, S. and Li, Y. and Feng, S. and Tian, H. and Wu, H. and Wang, H.",
      "journal": "AAAI",
      "year": 2020,
      "doi": "10.1609/aaai.v34i05.6428"
    }
  ],
  "appendices": [
    {
      "id": "proof",
      "title": "附录 A：注意力分数的闭式近似",
      "file": "sections/appendix-proof.tex"
    }
  ],
  "acknowledgments": "作者感谢匿名审稿人的宝贵意见。本工作受国家自然科学基金（编号 62100000）资助的部分支持。",
  "funding": "国家自然科学基金面上项目（62100000）；山东省重点研发计划（2026CX001）。",
  "build": {
    "documentclass": "papex",
    "fontset": "fandol",
    "bibStyle": "numeric",
    "columns": 1,
    "hyperref": true
  }
}
